id,title,author,created_at,closed_at,labels,time_to_solve
2003585831,Bluetooth: host: Don't push the TS flag on `buf` itself,jori-nordic,2024-08-05 09:49:16+00:00,2024-08-08 10:07:09+00:00,"{'bug': 1, 'area: Bluetooth': 1, 'area: Bluetooth Host': 1, 'platform: nRF BSIM': 1}",3 days 00:17:53
2000063146,boards: litex: activate sfdp runtime,maass-hamburg,2024-08-02 06:20:22+00:00,2024-08-05 08:15:58+00:00,"{'bug': 1, 'area: RISCV': 1, 'Hotfix': 1, 'platform: LiteX': 1, 'size: XS': 1}",3 days 01:55:36
1998708275,[Backport v3.7-branch] linker: section_tags: fix missing include,zephyrbot,2024-08-01 14:44:49+00:00,2024-09-06 17:06:45+00:00,"{'bug': 1, 'area: Linker Scripts': 1, 'Backport': 1}",36 days 02:21:56
1996535597,drivers/sensor/st: Fix wrong data byte swap for be,avisconti,2024-07-31 14:21:44+00:00,2024-08-27 11:07:53+00:00,"{'bug': 1, 'priority: low': 1, 'area: Drivers': 1, 'area: Sensors': 1, 'backport v3.7-branch': 1}",26 days 20:46:09
1995822886,modem: ubx: fix incoming byte processing,joerchan,2024-07-31 08:04:56+00:00,2024-08-02 07:29:18+00:00,"{'bug': 1, 'Trivial': 1, 'area: Modem': 1, 'area: GNSS': 1}",1 days 23:24:22
1995244328,drivers: i3c: common: Do not treat GETCAPS failure as error for 1.0 d,albertofloyd,2024-07-30 22:00:07+00:00,2024-08-02 07:30:47+00:00,"{'bug': 1, 'area: I3C': 1, 'size: XS': 1, 'backport v3.7-branch': 1}",2 days 09:30:40
1994671343,Bluetooth: L2CAP: Set NULL callback for PDUs,jori-nordic,2024-07-30 15:23:58+00:00,2024-08-01 15:49:38+00:00,"{'bug': 1, 'area: Bluetooth': 1, 'area: Bluetooth Host': 1, 'platform: nRF BSIM': 1, 'backport v3.7-branch': 1}",2 days 00:25:40
1992289781,da1469x: Fixes entropy and gpio drivers,ydamigos,2024-07-29 13:44:51+00:00,2024-08-19 21:23:18+00:00,"{'bug': 1, 'area: GPIO': 1, 'area: Crypto / RNG': 1, 'platform: Renesas SmartBond': 1, 'backport v3.7-branch': 1}",21 days 07:38:27
1991594866,drivers: ethernet: eth_xmc4xxx: fix get_phy,maass-hamburg,2024-07-29 07:53:43+00:00,2024-08-12 10:43:25+00:00,"{'bug': 1, 'area: Ethernet': 1, 'Trivial': 1, 'platform: Infineon': 1, 'size: XS': 1}",14 days 02:49:42
1990961054,drivers: video: introduce CONFIG_VIDEO_LOG_LEVEL,josuah,2024-07-28 15:31:38+00:00,2024-09-05 18:11:35+00:00,"{'priority: low': 1, 'area: Drivers': 1, 'area: Logging': 1, 'platform: STM32': 1, 'area: Video': 1, 'platform: NXP Drivers': 1}",39 days 02:39:57
1985842133,lis2dux12: fix temp conversion (and other issues),avisconti,2024-07-24 16:34:14+00:00,2024-07-27 07:37:11+00:00,"{'bug': 1, 'area: Drivers': 1, 'area: Sensors': 1, 'area: Samples': 1, 'area: Shields': 1, 'backport v3.7-branch': 1}",2 days 15:02:57
1982832149,Bluetooth: Host: Fix bt_disable() for IPC giving HCI Reset timeout,rugeGerritsen,2024-07-23 08:53:50+00:00,2024-07-25 07:14:39+00:00,"{'bug': 1, 'area: Bluetooth': 1, 'Trivial': 1, 'area: Bluetooth Host': 1}",1 days 22:20:49
1982759638,intel: adsp: fix firmware image in IMR overwriting,lyakh,2024-07-23 08:13:43+00:00,2024-07-27 07:42:27+00:00,"{'bug': 1, 'priority: high': 1, 'platform: Intel ADSP': 1}",3 days 23:28:44
1982688766,west: linkserver: Fix version detect for ihex support,PetervdPerk-NXP,2024-07-23 07:32:04+00:00,2024-09-26 07:34:54+00:00,"{'bug': 1, 'area: West': 1, 'Trivial': 1, 'size: XS': 1}",65 days 00:02:50
1982517701,gdbstub: fix compilation error on ARM & improve test coverage,ycsin,2024-07-23 05:18:12+00:00,2024-07-27 07:43:00+00:00,"{'bug': 1, 'area: ARM': 1, 'area: Debugging': 1, 'area: Architectures': 1, 'backport v3.7-branch': 1}",4 days 02:24:48
1978901299,include: usb: fix designator order in usbd.h header,jfischer-no,2024-07-19 22:11:04+00:00,2024-07-27 07:47:01+00:00,"{'bug': 1, 'area: USB': 1, 'Experimental': 1}",7 days 09:35:57
1978082264,Bluetooth: TBS: Add missing endian handling in TBS,Thalley,2024-07-19 13:58:14+00:00,2024-07-27 07:48:09+00:00,"{'bug': 1, 'area: Bluetooth': 1, 'area: Bluetooth Audio': 1}",7 days 17:49:55
1977892865,linker: section_tags: fix missing include,Finomnis,2024-07-19 12:24:44+00:00,2024-08-01 14:44:06+00:00,"{'bug': 1, 'area: Linker Scripts': 1, 'size: XS': 1, 'backport v3.7-branch': 1}",13 days 02:19:22
1977682558,modules: tf-m: fix git clone during build,tomi-font,2024-07-19 10:03:21+00:00,2024-07-25 10:25:33+00:00,"{'bug': 1, 'priority: high': 1, 'manifest': 1, 'manifest-trusted-firmware-m': 1, 'area: TF-M': 1, 'Release Blocker': 1}",6 days 00:22:12
1976490075,doc: Fix typo in SPSC lockfree queue docs,teburd,2024-07-18 17:10:50+00:00,2024-07-20 08:18:28+00:00,"{'bug': 1, 'area: Kernel': 1, 'area: Documentation': 1, 'Trivial': 1, 'size: XS': 1}",1 days 15:07:38
1976103212,dts: fix warnings in nxp_rt11xx.dtsi,Finomnis,2024-07-18 14:02:38+00:00,2024-07-29 12:16:19+00:00,"{'bug': 1, 'platform: NXP': 1, 'Trivial': 1, 'backport v3.7-branch': 1}",10 days 22:13:41
1975690614,storage/stream_flash: Fix write_block_size too small,de-nordic,2024-07-18 10:30:19+00:00,2024-07-18 16:32:36+00:00,"{'bug': 1, 'area: Storage': 1, 'Trivial': 1, 'Release Blocker': 1}",0 days 06:02:17
1975576202,net: coap: Fix underlying type for block number,rlubos,2024-07-18 09:44:40+00:00,2024-08-03 03:12:48+00:00,"{'bug': 1, 'area: Networking': 1, 'area: LWM2M': 1, 'Release Notes': 1, 'backport v3.7-branch': 1}",15 days 17:28:08
1975494209,dts: bindings: Fix license identifiers in a few files provided by Nordic,anangl,2024-07-18 09:02:07+00:00,2024-07-18 13:23:03+00:00,"{'bug': 1, 'area: Flash': 1, 'platform: nRF': 1, 'Trivial': 1, 'Release Blocker': 1}",0 days 04:20:56
1975323200,arch: riscv: stacktrace: fix output without `ra` on the stack top,ycsin,2024-07-18 07:29:58+00:00,2024-08-06 21:17:17+00:00,"{'bug': 1, 'area: RISCV': 1, 'backport v3.7-branch': 1}",19 days 13:47:19
1975304372,arch: riscv: stacktrace: make `CONFIG_EXCEPTION_STACK_TRACE` optional,ycsin,2024-07-18 07:20:53+00:00,2024-08-14 09:59:27+00:00,"{'bug': 1, 'area: RISCV': 1, 'area: Architectures': 1, 'backport v3.7-branch': 1}",27 days 02:38:34
1975170789,pm: Do not select deprecated symbol,ceolin,2024-07-18 05:56:04+00:00,2024-07-22 07:28:54+00:00,"{'bug': 1, 'area: Power Management': 1}",4 days 01:32:50
1973985907,ztest: shell: Fix compilation error for NEWLIB_LIBC,golowanow,2024-07-17 15:23:28+00:00,2024-07-27 12:08:15+00:00,"{'bug': 1, 'area: Testsuite': 1, 'size: XS': 1}",9 days 20:44:47
1973841454,boards: disco_l475_iot1: fix arduino_i2c config,kartben,2024-07-17 14:22:06+00:00,2024-07-30 17:29:00+00:00,"{'bug': 1, 'platform: STM32': 1, 'size: XS': 1, 'backport v3.7-branch': 1}",13 days 03:06:54
1971904009,drivers: mdio: Clear interrupt signal in ISR,decsny,2024-07-16 15:56:05+00:00,2024-07-27 12:10:42+00:00,"{'bug': 1, 'Trivial': 1, 'area: MDIO': 1, 'platform: NXP Drivers': 1, 'backport v3.7-branch': 1}",10 days 20:14:37
1971392660,drivers: ethernet: phy: phy_mii: use no-reset option,maass-hamburg,2024-07-16 11:53:36+00:00,2024-07-27 12:12:50+00:00,"{'bug': 1, 'area: Ethernet': 1, 'size: XS': 1}",11 days 00:19:14
1971205886,net: sockets: tls: Fix poll update event check,rlubos,2024-07-16 10:03:57+00:00,2024-07-27 12:13:18+00:00,"{'bug': 1, 'area: Networking': 1, 'area: Sockets': 1, 'backport v3.7-branch': 1}",11 days 02:09:21
1970614002,linker: esp32: fix cpp rom region,sylvioalves,2024-07-16 02:50:24+00:00,2024-08-06 21:17:24+00:00,"{'bug': 1, 'platform: ESP32': 1, 'size: XS': 1, 'backport v3.7-branch': 1}",21 days 18:27:00
1970228673,bl5340_dvk: Move MIPI_DBI interface back to spi4,dberlin,2024-07-15 21:01:46+00:00,2024-07-27 12:14:15+00:00,"{'bug': 1, 'priority: low': 1, 'size: XS': 1, 'platform: Ezurio': 1, 'backport v3.7-branch': 1}",11 days 15:12:29
1970123799,serial: uart_async_rx: Avoid possible division by zero,ceolin,2024-07-15 19:55:35+00:00,2024-07-27 12:14:26+00:00,"{'bug': 1, 'area: UART': 1, 'Trivial': 1, 'size: XS': 1, 'backport v3.7-branch': 1}",11 days 16:18:51
1969900426,arc: nsim: vpx5: fix SoC config issue which leads to cmake error,evgeniy-paltsev,2024-07-15 17:32:23+00:00,2024-07-17 20:18:41+00:00,"{'bug': 1, 'area: ARC': 1, 'platform: Synopsys': 1}",2 days 02:46:18
1969598320,tests: dma/chan_blen_transfer: relocate TX and RX buffers,mathieuchopstm,2024-07-15 14:46:22+00:00,2024-08-22 18:25:10+00:00,"{'priority: low': 1, 'area: DMA': 1, 'backport v3.7-branch': 1}",38 days 03:38:48
1969306287,samples: bluetooth: Fix periodic_sync_rsp sample,olivier-le-sage,2024-07-15 12:22:17+00:00,2024-07-27 12:14:38+00:00,"{'bug': 1, 'area: Bluetooth': 1, 'area: Samples': 1}",11 days 23:52:21
1969006349,soc/espressif/esp32c6: Do not set HAS_PM or HAS_POWEROFF,aescolar,2024-07-15 09:28:03+00:00,2024-07-16 16:53:10+00:00,"{'bug': 1, 'platform: ESP32': 1, 'Trivial': 1}",1 days 07:25:07
1968236314,posix: deprecated: include dependencies from before deprecation,cfriedt,2024-07-14 11:34:34+00:00,2024-10-13 00:35:43+00:00,"{'bug': 1, 'area: POSIX': 1, 'Stale': 1}",90 days 13:01:09
1968053308,net + posix: avoid host includes when building for native_sim,cfriedt,2024-07-13 21:03:41+00:00,2024-07-27 12:17:24+00:00,"{'bug': 1, 'area: Networking': 1, 'area: POSIX': 1, 'backport v3.7-branch': 1}",13 days 15:13:43
1967711658,Bluetooth: host: Use correct user_data size for hci_rx_pool,aescolar,2024-07-13 08:05:18+00:00,2024-07-13 14:25:32+00:00,"{'bug': 1, 'area: Bluetooth': 1, 'area: Bluetooth Host': 1, 'size: XS': 1}",0 days 06:20:14
1967207805,rtio: workq: bug-fix: Initialize Work item before using,ubieda,2024-07-12 19:27:30+00:00,2024-07-13 14:27:59+00:00,"{'bug': 1, 'Trivial': 1, 'area: RTIO': 1}",0 days 19:00:29
1966162079,logging: Trigger logging thread when above threshold,thales-nascimento,2024-07-12 08:30:37+00:00,2024-08-02 23:45:59+00:00,"{'bug': 1, 'area: Logging': 1, 'size: XS': 1, 'backport v3.7-branch': 1}",21 days 15:15:22
1966159690,modules: hal_nordic: defines NRF_CONFIG_NFCT_PINS_AS_GPIOS for nRF54L15,GardeningStevie,2024-07-12 08:29:00+00:00,2024-07-12 20:11:45+00:00,"{'bug': 1, 'platform: nRF': 1}",0 days 11:42:45
1966134637,modules: hal_nordic: nrfs: fix buffer used in nrfs send,lstnl,2024-07-12 08:12:10+00:00,2024-07-12 13:12:25+00:00,"{'bug': 1, 'platform: nRF': 1, 'Trivial': 1}",0 days 05:00:15
1964710239,samples: ipc: icmsg: fix unbalanced nRF53 cpunet enable calls,gmarull,2024-07-11 14:42:07+00:00,2024-07-12 13:15:08+00:00,"{'bug': 1, 'area: Samples': 1, 'area: IPC': 1, 'Trivial': 1}",0 days 22:33:01
1964601803,samples: drivers: mbox: fix regex when using channels 0/1,gmarull,2024-07-11 13:48:40+00:00,2024-07-12 10:23:53+00:00,"{'bug': 1, 'area: Samples': 1, 'Trivial': 1, 'area: mbox': 1}",0 days 20:35:13
1964220727,drivers: i2c: i2c_nrfx_twi: enforce stop after scatter/gather,bjarki-andreasen,2024-07-11 10:19:43+00:00,2024-07-29 12:02:52+00:00,"{'bug': 1, 'priority: low': 1, 'area: I2C': 1, 'platform: nRF': 1, 'backport v3.7-branch': 1}",18 days 01:43:09
1964151378,net: lib: http_server: Fix HTTP1 POST request handling,rlubos,2024-07-11 09:41:38+00:00,2024-07-11 17:10:10+00:00,"{'bug': 1, 'area: Networking': 1, 'Trivial': 1}",0 days 07:28:32
1964038443,Bluetooth: shell: Unregister the previous scan callback to avoid register repeatedly before register,nngt88,2024-07-11 08:44:22+00:00,2024-07-11 11:57:44+00:00,"{'bug': 1, 'area: Bluetooth': 1, 'area: Bluetooth Host': 1}",0 days 03:13:22
1963648096,drivers: intc: eirq_nxp_s32: allow the same callback to be set,Dat-NguyenDuy,2024-07-11 03:35:19+00:00,2024-07-12 13:39:13+00:00,"{'bug': 1, 'Trivial': 1, 'area: Interrupt Controller': 1, 'platform: NXP S32': 1}",1 days 10:03:54
1963555623,toolchain: arcmwdt: fix incorrect __STDC_LIB_EXT1__ macro presence in case of minimal libc,evgeniy-paltsev,2024-07-11 02:09:49+00:00,2024-07-12 13:34:58+00:00,"{'bug': 1, 'area: Build System': 1, 'area: Toolchains': 1, 'Trivial': 1, 'size: XS': 1}",1 days 11:25:09
1963343396,drivers: usb_dc_rpi_pico: set AVAILABLE bit separately,jfischer-no,2024-07-10 22:16:17+00:00,2024-07-12 13:38:31+00:00,"{'bug': 1, 'area: Drivers': 1, 'area: USB': 1}",1 days 15:22:14
1963183203,modules: hal_nxp: Fix i2s define mistake,decsny,2024-07-10 20:25:07+00:00,2024-07-11 14:13:35+00:00,"{'bug': 1, 'platform: NXP': 1, 'Trivial': 1}",0 days 17:48:28
1962636437,Fix I2S_Speed Test with Watermark Definition,EmilioCBen,2024-07-10 15:03:20+00:00,2024-07-10 20:15:49+00:00,"{'bug': 1, 'platform: NXP': 1, 'Trivial': 1}",0 days 05:12:29
1962377610,bluetooth: gatt: Fix ATT Read By Type by DB change unaware client,sjanc,2024-07-10 13:16:33+00:00,2024-08-27 11:14:59+00:00,"{'bug': 1, 'area: Bluetooth': 1, 'area: Bluetooth Qualification': 1, 'area: Bluetooth Host': 1, 'backport v3.7-branch': 1}",47 days 21:58:26
1962205441,modules: mbedtls: fix MBEDTLS_PSA_P256M_DRIVER_RAW Kconfig option,tomi-font,2024-07-10 11:48:06+00:00,2024-07-15 14:36:58+00:00,"{'bug': 1, 'area: Crypto / RNG': 1}",5 days 02:48:52
1961920408,intel-adsp: fix ACE power-off assembly,lyakh,2024-07-10 09:33:30+00:00,2024-07-12 09:48:21+00:00,"{'bug': 1, 'platform: Intel ADSP': 1}",2 days 00:14:51
1961205439,cmake: Add LL_EXTENSION_BUILD to EDK flags,edersondisouza,2024-07-09 23:38:31+00:00,2024-07-11 17:10:27+00:00,"{'bug': 1, 'area: Build System': 1, 'Trivial': 1, 'area: llext': 1}",1 days 17:31:56
1960652297,toolchain: arcmwdt: always enable TLS in case of CPP,evgeniy-paltsev,2024-07-09 17:27:18+00:00,2024-07-12 10:22:13+00:00,"{'bug': 1, 'area: Build System': 1, 'area: Toolchains': 1, 'size: XS': 1}",2 days 16:54:55
1960547021,tests/samples: posix: env: fix failure in case of minimal libc is used,evgeniy-paltsev,2024-07-09 16:21:24+00:00,2024-07-11 17:24:03+00:00,"{'bug': 1, 'area: Samples': 1, 'area: POSIX': 1}",2 days 01:02:39
1960339736,linker: fix device deferred init for MWDT toolchain,evgeniy-paltsev,2024-07-09 14:46:29+00:00,2024-07-11 17:10:46+00:00,"{'bug': 1, 'area: ARC': 1, 'area: Linker Scripts': 1}",2 days 02:24:17
1960275528,net: lib: http_server: Close sockets on server core errors,rlubos,2024-07-09 14:14:34+00:00,2024-07-11 17:11:05+00:00,"{'bug': 1, 'area: Networking': 1, 'area: Sockets': 1}",2 days 02:56:31
1959397290,Bluetooth: Controller: Fix missed PTO subevent for subsequent BIS,cvinayak,2024-07-09 07:32:10+00:00,2024-07-30 17:27:46+00:00,"{'bug': 1, 'area: Bluetooth': 1, 'area: Bluetooth Controller': 1}",21 days 09:55:36
1959297214,west.yml: MCUboot synchronization from upstream,nordicjm,2024-07-09 06:37:13+00:00,2024-07-11 07:36:31+00:00,"{'bug': 1, 'Release Notes': 1, 'manifest': 1, 'manifest-mcuboot': 1, 'size: XS': 1}",2 days 00:59:18
1959062160,dts: bindings: dac: ad569x: Remove unused properties,bwitherspoon,2024-07-09 03:25:23+00:00,2024-07-11 14:15:29+00:00,"{'bug': 1, 'area: Devicetree Binding': 1, 'area: DAC': 1, 'platform: ADI': 1}",2 days 10:50:06
1958963776,drivers: dac: dac_ad569x: Add bit shift for 14/12-bit variants,bwitherspoon,2024-07-09 01:41:40+00:00,2024-07-11 07:37:13+00:00,"{'bug': 1, 'area: DAC': 1}",2 days 05:55:33
1958939206,drivers: dac: dac_ad56xx: Fix channel range check,bwitherspoon,2024-07-09 01:10:55+00:00,2024-07-09 19:31:59+00:00,"{'bug': 1, 'Trivial': 1, 'area: DAC': 1, 'size: XS': 1}",0 days 18:21:04
1958769595,drivers: mdio_nxp_enet: Fix busy wait,decsny,2024-07-08 22:33:36+00:00,2024-07-10 23:13:27+00:00,"{'bug': 1, 'area: Ethernet': 1, 'area: MDIO': 1, 'platform: NXP Drivers': 1}",2 days 00:39:51
1958728381,tests: logging/dictionary: pytest only looks at last output,dcpleung,2024-07-08 21:52:05+00:00,2024-07-09 21:25:22+00:00,"{'bug': 1, 'area: Logging': 1, 'Trivial': 1}",0 days 23:33:17
1958655389,tests: i2s_speed: Fix RT1170_EVK overlay files,decsny,2024-07-08 20:59:20+00:00,2024-07-10 09:38:40+00:00,"{'bug': 1, 'platform: NXP': 1, 'Trivial': 1, 'area: I2S': 1}",1 days 12:39:20
1958593011,tests: logging/dictionary: filter for backend,dcpleung,2024-07-08 20:18:34+00:00,2024-07-09 21:24:02+00:00,"{'bug': 1, 'area: Logging': 1, 'Trivial': 1}",1 days 01:05:28
1958428777,modem: hl7800: set RX socket remote address,rerickson1,2024-07-08 18:46:23+00:00,2024-07-10 20:16:03+00:00,"{'bug': 1, 'priority: low': 1, 'area: Modem Drivers': 1}",2 days 01:29:40
1958359980,drivers/sensor/tdk icm42688_rtio: Fix build error,aescolar,2024-07-08 18:01:11+00:00,2024-07-08 18:14:27+00:00,"{'bug': 1, 'area: Sensors': 1, 'Trivial': 1, 'size: XS': 1}",0 days 00:13:16
1958343946,drivers/spi/spi_xlnx_axi_quadspi: Build fix w CONFIG_SPI_ASYNC,aescolar,2024-07-08 17:49:59+00:00,2024-07-10 23:13:47+00:00,"{'bug': 1, 'area: SPI': 1, 'Trivial': 1, 'platform: Xilinx': 1}",2 days 05:23:48
1958264287,net: ptp: Misc clock sync bugs,kartben,2024-07-08 17:01:08+00:00,2024-08-06 08:17:27+00:00,"{'bug': 1, 'area: Networking': 1, 'backport v3.7-branch': 1}",28 days 15:16:19
1958133298,tests: posix: headers: fix build error when minimal libc is used,evgeniy-paltsev,2024-07-08 15:44:07+00:00,2024-07-12 09:49:29+00:00,"{'bug': 1, 'area: C Library': 1}",3 days 18:05:22
1958120011,arch: arm: cortex_m: add ip & lr to the clobber list,ithinuel,2024-07-08 15:37:17+00:00,2024-07-10 15:58:14+00:00,"{'bug': 1, 'area: ARM': 1}",2 days 00:20:57
1958005315,posix: shm: fix build error with minimal libc,evgeniy-paltsev,2024-07-08 14:40:46+00:00,2024-07-10 12:40:49+00:00,"{'bug': 1, 'area: POSIX': 1, 'Trivial': 1, 'size: XS': 1}",1 days 22:00:03
1958001646,scripts: list_hardware: Find all SoCs before checking runner configs,57300,2024-07-08 14:38:53+00:00,2024-07-10 15:46:52+00:00,{'bug': 1},2 days 01:07:59
1957884015,test: logging: dictionary: fix build error with minimal libc,evgeniy-paltsev,2024-07-08 13:49:19+00:00,2024-07-09 06:48:25+00:00,"{'bug': 1, 'area: Logging': 1, 'Trivial': 1, 'size: XS': 1}",0 days 16:59:06
1957876348,Bluetooth: Shell: Fix native shell build,theob-pro,2024-07-08 13:45:52+00:00,2024-07-10 15:47:08+00:00,"{'bug': 1, 'area: Bluetooth': 1}",2 days 02:01:16
1957828182,tests: logging: log_backend_uart: fix build error,evgeniy-paltsev,2024-07-08 13:25:15+00:00,2024-07-09 06:49:05+00:00,"{'bug': 1, 'area: Logging': 1, 'Trivial': 1}",0 days 17:23:50
1957762566,Bluetooth: host: Add lower bound for `CONFIG_BT_BUF_ACL_RX_COUNT`,jori-nordic,2024-07-08 12:54:54+00:00,2024-07-10 15:47:26+00:00,"{'bug': 1, 'area: Bluetooth': 1, 'area: Samples': 1, 'Release Notes': 1, 'area: Bluetooth Controller': 1, 'area: Bluetooth Host': 1, 'platform: nRF BSIM': 1}",2 days 02:52:32
1957714472,drivers: ethernet: nxp_enet: Fused MAC address fixes,allemanm,2024-07-08 12:32:10+00:00,2024-08-02 23:47:10+00:00,"{'bug': 1, 'area: Ethernet': 1, 'platform: NXP Drivers': 1, 'backport v3.7-branch': 1}",25 days 11:15:00
1957511523,kernel: fatal: Fix NO_OPTIMIZATIONS build (logging + no multithreading),nordic-krch,2024-07-08 10:45:25+00:00,2024-08-07 23:03:41+00:00,"{'bug': 1, 'area: Kernel': 1, 'backport v3.7-branch': 1}",30 days 12:18:16
1957469000,soc: nordic: common: dmm: fix region alignment getter,nika-nordic,2024-07-08 10:21:42+00:00,2024-07-10 12:42:40+00:00,"{'bug': 1, 'platform: nRF': 1}",2 days 02:20:58
1957390970,tests/drivers pwm_clock: Build fix sam_v71_xult,aescolar,2024-07-08 09:41:21+00:00,2024-07-08 18:55:15+00:00,"{'bug': 1, 'area: ADC': 1, 'area: Samples': 1, 'area: Clock Control': 1, 'Trivial': 1}",0 days 09:13:54
1957352520,Bluetooth: SDP: Fix stack override issue,lylezhu2012,2024-07-08 09:21:24+00:00,2024-07-11 14:15:54+00:00,"{'bug': 1, 'area: Bluetooth': 1, 'area: Bluetooth Host': 1, 'area: Bluetooth Classic': 1}",3 days 04:54:30
1957344709,net: ethernet: check vlan iface existence,maass-hamburg,2024-07-08 09:17:42+00:00,2024-07-10 09:35:48+00:00,"{'bug': 1, 'area: Networking': 1}",2 days 00:18:06
1957341640,Samples: max17048: updated voltage output and added units ,Goyalrahul1516,2024-07-08 09:16:07+00:00,2024-07-10 09:36:28+00:00,"{'bug': 1, 'area: Samples': 1, 'area: Fuel Gauge': 1, 'platform: ADI': 1}",2 days 00:20:21
1957059610,arch: riscv: stacktrace: fix user thread stack bound check,ycsin,2024-07-08 06:44:14+00:00,2024-07-27 17:47:51+00:00,"{'bug': 1, 'area: RISCV': 1, 'backport v3.7-branch': 1}",19 days 11:03:37
1956506336,boards: frdm_rw612: Fix flash size,decsny,2024-07-07 16:59:22+00:00,2024-07-08 07:21:01+00:00,"{'bug': 1, 'platform: NXP': 1, 'Trivial': 1, 'size: XS': 1}",0 days 14:21:39
1956164754,samples: net: cellular_modem: fix division by zero in sample_echo_packet,nmpluta,2024-07-06 20:56:31+00:00,2024-07-10 09:37:44+00:00,"{'bug': 1, 'area: Networking': 1, 'area: Samples': 1, 'area: Modem': 1}",3 days 12:41:13
1955970304,tests: arch: common: stack_unwind: fix symtab test,ycsin,2024-07-06 09:39:12+00:00,2024-07-09 23:44:08+00:00,"{'bug': 1, 'area: Architectures': 1}",3 days 14:04:56
1955148912,drivers: eth: esp32: fix build to enable statistics,sylvioalves,2024-07-05 12:56:26+00:00,2024-07-08 18:55:47+00:00,"{'bug': 1, 'area: Ethernet': 1, 'platform: ESP32': 1, 'Trivial': 1}",3 days 05:59:21
1955063550,soc: silabs: Include series-specific Kconfig,asmellby,2024-07-05 11:58:59+00:00,2024-07-09 06:59:02+00:00,"{'bug': 1, 'platform: Silabs': 1}",3 days 19:00:03
1954992611,Bluetooth: A2DP: Fix mistake parameter,MarkWangChinese,2024-07-05 11:08:00+00:00,2024-07-11 14:16:10+00:00,"{'bug': 1, 'area: Bluetooth': 1, 'area: Bluetooth Host': 1, 'area: Bluetooth Classic': 1, 'size: XS': 1}",6 days 03:08:10
1954973107,logging: Fixes in dependencies around dictionary frontend,nordic-krch,2024-07-05 10:54:03+00:00,2024-07-09 12:01:56+00:00,"{'bug': 1, 'area: Logging': 1}",4 days 01:07:53
1954803430,drivers: ptp_clock_nxp_enet: add module_dev to driver config,kartben,2024-07-05 09:01:36+00:00,2024-07-09 21:20:12+00:00,"{'bug': 1, 'area: Clocks': 1, 'platform: NXP Drivers': 1, 'size: XS': 1}",4 days 12:18:36
1954700079,Bluetooth: Mark bt_<type>_err_to_str() APIs experimental,rugeGerritsen,2024-07-05 07:55:44+00:00,2024-07-11 17:12:00+00:00,"{'bug': 1, 'area: Bluetooth': 1, 'area: Bluetooth Host': 1}",6 days 09:16:16
1954617526,llext: disable verbose for SLID generation scripts,mathieuchopstm,2024-07-05 06:57:41+00:00,2024-07-09 15:21:18+00:00,"{'bug': 1, 'area: Build System': 1, 'Trivial': 1}",4 days 08:23:37
1954518637,logging: Keep module names if runtime filtering is used,nordic-krch,2024-07-05 05:41:43+00:00,2024-07-05 10:49:20+00:00,"{'bug': 1, 'area: Logging': 1}",0 days 05:07:37
1953627914,boards: nrfbsim: Fix testargs with non host libC,aescolar,2024-07-04 13:13:32+00:00,2024-07-06 15:03:26+00:00,"{'bug': 1, 'area: IPC': 1, 'Trivial': 1, 'platform: nRF BSIM': 1}",2 days 01:49:54
1953503681,logging: Fix missing CONFIG_ prefix,joerchan,2024-07-04 12:03:02+00:00,2024-07-04 16:08:55+00:00,"{'bug': 1, 'area: Logging': 1, 'Trivial': 1, 'size: XS': 1}",0 days 04:05:53
1953317830,samples/net/dhcpv4_client: Exclude native_posix due to EVENTFD,aescolar,2024-07-04 10:14:39+00:00,2024-07-04 15:59:34+00:00,"{'bug': 1, 'area: Networking': 1, 'area: Samples': 1, 'Trivial': 1}",0 days 05:44:55
1953093501,dts: npx: Fix sramx offset for LPC55S06,mateusz-holenko,2024-07-04 08:17:32+00:00,2024-07-09 19:21:14+00:00,"{'bug': 1, 'platform: NXP': 1, 'Trivial': 1, 'size: XS': 1}",5 days 11:03:42
1953010020,drivers: adc: adc_nrfx_saadc: Patch neg single ended readings,bjarki-andreasen,2024-07-04 07:27:53+00:00,2024-07-12 17:50:29+00:00,"{'bug': 1, 'area: ADC': 1, 'area: Sensors': 1, 'platform: nRF': 1, 'Release Notes': 1}",8 days 10:22:36
1952541377,sensor: lps22hh: fix: Prevent overwriting values not fetched,ubieda,2024-07-03 22:57:47+00:00,2024-07-09 09:51:16+00:00,"{'bug': 1, 'area: Sensors': 1}",5 days 10:53:29
1952528666,sensor: lis2dux12: fix: CID 363712: Initialize mode-fs,ubieda,2024-07-03 22:42:04+00:00,2024-07-09 17:05:03+00:00,"{'bug': 1, 'area: Sensors': 1, 'size: XS': 1}",5 days 18:22:59
1952506626,sensor: veml7700: coverity-fix: Simplify unsigned comparison,ubieda,2024-07-03 22:20:32+00:00,2024-07-12 09:56:32+00:00,"{'bug': 1, 'area: Sensors': 1}",8 days 11:36:00
1952481855,Bluetooth: Host: Fix recv_enabled field for PAST,Thalley,2024-07-03 21:54:09+00:00,2024-07-08 07:27:12+00:00,"{'bug': 1, 'area: Bluetooth': 1, 'Release Notes': 1, 'area: Bluetooth Host': 1}",4 days 09:33:03
1952038545,kernel kconfig: Do not enable STATIC_INIT_GNU w the old native_posix,aescolar,2024-07-03 16:55:39+00:00,2024-07-06 15:03:18+00:00,"{'bug': 1, 'area: Kernel': 1, 'area: Linker Scripts': 1}",2 days 22:07:39
1951965285,Bluetooth: GATT: factor out notify callback,jori-nordic,2024-07-03 16:04:02+00:00,2024-07-05 16:38:17+00:00,"{'bug': 1, 'area: Bluetooth': 1, 'area: Bluetooth Host': 1}",2 days 00:34:15
1951942109,dts: nxp: fix various DTC warnings,decsny,2024-07-03 15:51:17+00:00,2024-07-09 19:21:37+00:00,"{'bug': 1, 'platform: NXP': 1, 'Trivial': 1}",6 days 03:30:20
1951850564,Bluetooth: host: disallow scan with timeout when BT_PRIVACY=y,jori-nordic,2024-07-03 15:00:36+00:00,2024-07-05 16:43:40+00:00,"{'bug': 1, 'area: Bluetooth': 1, 'area: Bluetooth Host': 1}",2 days 01:43:04
1951671829,drivers: memc: fix Kconfig option MEMC_STM32,miggazElquez,2024-07-03 13:37:44+00:00,2024-07-05 16:43:06+00:00,"{'bug': 1, 'platform: STM32': 1, 'area: MEMC': 1}",2 days 03:05:22
1951392447,boards: nxp: enable mcux udc on RT1170-EVK,MarkWangChinese,2024-07-03 11:10:56+00:00,2024-07-08 07:28:41+00:00,"{'bug': 1, 'area: USB': 1, 'area: Samples': 1, 'platform: NXP': 1}",4 days 20:17:45
1951297516,scripts: west_commands: Fix west boards for SoC and arch in modules,57300,2024-07-03 10:20:11+00:00,2024-07-05 12:55:09+00:00,"{'bug': 1, 'area: West': 1}",2 days 02:34:58
1951245362,ztest: shell: Fix memory leaks processing test arguments,golowanow,2024-07-03 09:52:56+00:00,2024-07-11 14:16:30+00:00,"{'bug': 1, 'area: Testsuite': 1}",8 days 04:23:34
1951020335,net: mqtt: Fix possible socket leak with websocket transport,rlubos,2024-07-03 07:54:34+00:00,2024-07-05 10:29:33+00:00,"{'bug': 1, 'area: Networking': 1}",2 days 02:34:59
1950594948,net: socket: fix `sys/_timespec.h` not found error,ycsin,2024-07-03 01:47:54+00:00,2024-07-12 13:12:59+00:00,"{'bug': 1, 'area: Networking': 1, 'size: XS': 1}",9 days 11:25:05
